{
  "title": "Solat Jumaat",
  "description": "Friday congregational prayer session led by Ustaz Muhd Amirul Mukminin Bin Mohd Abdul Wahab, with Hj Sapari Bin Edros as bilal.",
  "mosque_ids": [
    "al-firdaus"
  ],
  "categories": [
    "prayer",
    "Jumuah"
  ],
  "status": "completed",
  "status_evidence": [
    {
      "source_id": "instagram:3988760215592011363",
      "locator": "caption",
      "quote": "Sesi solat Jumaat yang dipimpin oleh Ustaz Muhd Amirul Mukminin Bin Mohd Abdul Wahab dan bilal Hj Sapari Bin Edros"
    }
  ],
  "schedule": {
    "kind": "one_off",
    "timezone": "Asia/Singapore",
    "text": "18 September 2026",
    "occurrences": [
      {
        "date": "2026-09-18",
        "end_date": null,
        "start_time": null,
        "end_time": null
      }
    ],
    "recurrence": null
  },
  "location": {
    "mode": "physical",
    "name": "Masjid Al-Firdaus",
    "address": null,
    "online_url": null
  },
  "people": [
    {
      "name": "Ustaz Muhd Amirul Mukminin Bin Mohd Abdul Wahab",
      "role": "leader"
    },
    {
      "name": "Hj Sapari Bin Edros",
      "role": "other"
    }
  ],
  "languages": [
    "en",
    "ms"
  ],
  "audience": [
    "Muslim worshippers"
  ],
  "registration": {
    "requirement": "not_required",
    "url": null,
    "deadline_date": null,
    "instructions": null
  },
  "pricing": {
    "kind": "free",
    "prices": [],
    "notes": null
  },
  "sources": [
    {
      "id": "instagram:3988760215592011363",
      "platform": "instagram",
      "url": "https://www.instagram.com/p/Dda7EhgkoZj",
      "post_id": "3988760215592011363",
      "author_handle": "alfirdausmosquesg",
      "author_profile_id": "21287478549",
      "discovered_via": [],
      "published_at": "2026-09-18T07:41:33.000Z",
      "retrieved_at": "2026-09-21T08:47:45.529Z"
    }
  ],
  "evidence": [
    {
      "source_id": "instagram:3988760215592011363",
      "locator": "caption",
      "supports": [
        "/title",
        "/description",
        "/mosque_ids",
        "/status",
        "/schedule/occurrences/0/date",
        "/location/name",
        "/people"
      ]
    },
    {
      "source_id": "instagram:3988760215592011363",
      "locator": "slide:1",
      "supports": [
        "/title",
        "/schedule/occurrences/0/date",
        "/location/name"
      ]
    }
  ],
  "review": {
    "state": "candidate",
    "uncertainties": [
      "The exact prayer start time was not provided.",
      "The mosque address was not provided."
    ]
  },
  "notes": null,
  "extra_data": {
    "calendar_date_hijri": "6 Rabiulakhir 1448H",
    "role_note": "Hj Sapari Bin Edros is identified as bilal."
  },
  "id": "ae1e60b6-17c9-4788-a1ac-11c248d22ac9",
  "schema_version": "1.0"
}
