{
  "title": "Kuliah ‘Asr",
  "description": "Tafsir lecture after Solat ‘Asr.",
  "mosque_ids": [
    "sultan"
  ],
  "categories": [
    "lecture",
    "religious education"
  ],
  "status": "scheduled",
  "schedule": {
    "kind": "recurring",
    "timezone": "Asia/Singapore",
    "text": "Wednesday, after Solat ‘Asr; only on the 2nd and 4th week of the month",
    "occurrences": [],
    "recurrence": {
      "frequency": "monthly",
      "weekdays": [
        "WE"
      ],
      "rule_text": "On Wednesdays in the 2nd and 4th week of the month, after Solat ‘Asr",
      "starts_on": null,
      "ends_on": null,
      "start_time": {
        "kind": "prayer_relative",
        "prayer": "asr",
        "relation": "after",
        "offset_minutes": null,
        "literal": "After Solat ‘Asr"
      },
      "end_time": null,
      "excluded_dates": []
    }
  },
  "location": {
    "mode": "physical",
    "name": "Masjid Sultan Main Prayer Hall",
    "address": null,
    "online_url": null
  },
  "people": [
    {
      "name": "Ustaz Dr. Mohamed Qusayiry Thaha",
      "role": "speaker"
    }
  ],
  "languages": [
    "ms"
  ],
  "audience": [],
  "registration": {
    "requirement": "unknown",
    "url": null,
    "deadline_date": null,
    "instructions": null
  },
  "pricing": {
    "kind": "unknown",
    "prices": [],
    "notes": null
  },
  "evidence": [
    {
      "source_id": "instagram:3988052068128727481",
      "locator": "slide:1",
      "supports": [
        "/title",
        "/schedule",
        "/location",
        "/status"
      ]
    },
    {
      "source_id": "instagram:3988052068128727481",
      "locator": "slide:3",
      "supports": [
        "/schedule",
        "/people",
        "/languages"
      ]
    }
  ],
  "review": {
    "state": "candidate",
    "uncertainties": [
      "The poster states 2nd and 4th week but does not provide calendar dates."
    ]
  },
  "notes": null,
  "extra_data": {
    "theme": "Tadabbur (Ibrah Al-Quran)",
    "book": "Tafsir Al-Mishbah"
  },
  "id": "69329659-b0f0-4302-b193-3efac421dcc8",
  "schema_version": "1.0",
  "sources": [
    {
      "id": "instagram:3988052068128727481",
      "platform": "instagram",
      "url": "https://www.instagram.com/p/DdYaDnykyG5",
      "post_id": "3988052068128727481",
      "author_handle": "masjidsultan",
      "author_profile_id": "1593948450",
      "discovered_via": [],
      "published_at": "2026-09-17T08:14:35.000Z",
      "retrieved_at": "2026-09-21T09:26:39.697Z"
    }
  ]
}
