{
  "title": "Syarahan Majlis Maulidurrasul",
  "description": "Religious lecture and Maulidurrasul gathering with qasidah and communal meal.",
  "mosque_ids": [
    "al-firdaus"
  ],
  "categories": [
    "religious lecture",
    "maulid",
    "qasidah"
  ],
  "status": "completed",
  "status_evidence": [
    {
      "source_id": "instagram:3985869327069001704",
      "locator": "caption",
      "quote": "pada Sabtu, 12 September 2026 ... Masjid Al-Firdaus menutup tirai bulan Rabiulawal dengan mengadakan Syarahan Majlis Maulidurrasul."
    }
  ],
  "schedule": {
    "kind": "one_off",
    "timezone": "Asia/Singapore",
    "text": "Sabtu, 12 September 2026; time unspecified",
    "occurrences": [
      {
        "date": "2026-09-12",
        "end_date": null,
        "start_time": {
          "kind": "unspecified",
          "literal": "Time unspecified"
        },
        "end_time": null
      }
    ],
    "recurrence": null
  },
  "location": {
    "mode": "physical",
    "name": "Masjid Al-Firdaus",
    "address": null,
    "online_url": null
  },
  "people": [],
  "languages": [
    "ms"
  ],
  "audience": [
    "jemaah"
  ],
  "registration": {
    "requirement": "unknown",
    "url": null,
    "deadline_date": null,
    "instructions": null
  },
  "pricing": {
    "kind": "unknown",
    "prices": [],
    "notes": null
  },
  "sources": [
    {
      "id": "instagram:3985869327069001704",
      "platform": "instagram",
      "url": "https://www.instagram.com/p/DdQpwjxErfo",
      "post_id": "3985869327069001704",
      "author_handle": "alfirdausmosquesg",
      "author_profile_id": "21287478549",
      "discovered_via": [],
      "published_at": "2026-09-14T07:57:52.000Z",
      "retrieved_at": "2026-09-21T08:52:13.621Z"
    }
  ],
  "evidence": [
    {
      "source_id": "instagram:3985869327069001704",
      "locator": "caption",
      "supports": [
        "/title",
        "/status",
        "/schedule/occurrences/0/date",
        "/location/name"
      ]
    },
    {
      "source_id": "instagram:3985869327069001704",
      "locator": "slide:1",
      "supports": [
        "/categories",
        "/location/mode"
      ]
    },
    {
      "source_id": "instagram:3985869327069001704",
      "locator": "slide:8",
      "supports": [
        "/categories"
      ]
    },
    {
      "source_id": "instagram:3985869327069001704",
      "locator": "slide:15",
      "supports": [
        "/categories"
      ]
    }
  ],
  "review": {
    "state": "candidate",
    "uncertainties": [
      "Start and end times were not provided.",
      "Speaker and presenter names were not identified.",
      "Exact street address was not provided."
    ]
  },
  "notes": null,
  "extra_data": {
    "activities": [
      "syarahan",
      "qasidah",
      "communal meal"
    ]
  },
  "id": "5a237d7e-9645-4be3-91a0-288ce03dbf4e",
  "schema_version": "1.0"
}
