{
  "title": "Thursday Surah Al-Kahf Recitation",
  "description": "Thursday evening Surah Al-Kahf recitation.",
  "mosque_ids": [
    "sultan"
  ],
  "categories": [
    "recitation"
  ],
  "status": "scheduled",
  "schedule": {
    "kind": "recurring",
    "timezone": "Asia/Singapore",
    "text": "Every Thursday after Maghrib prayer",
    "occurrences": [],
    "recurrence": {
      "frequency": "weekly",
      "weekdays": [
        "TH"
      ],
      "rule_text": "Every Thursday after Maghrib prayer",
      "starts_on": null,
      "ends_on": null,
      "start_time": {
        "kind": "prayer_relative",
        "prayer": "maghrib",
        "relation": "after",
        "offset_minutes": null,
        "literal": "After Maghrib Prayer"
      },
      "end_time": null,
      "excluded_dates": []
    }
  },
  "location": {
    "mode": "physical",
    "name": "Masjid Sultan Main Prayer Hall",
    "address": null,
    "online_url": null
  },
  "people": [
    {
      "name": "Imam Muazzin of Masjid Sultan",
      "role": "leader"
    }
  ],
  "languages": [],
  "audience": [],
  "registration": {
    "requirement": "unknown",
    "url": null,
    "deadline_date": null,
    "instructions": null
  },
  "pricing": {
    "kind": "unknown",
    "prices": [],
    "notes": null
  },
  "evidence": [
    {
      "source_id": "instagram:3988052068128727481",
      "locator": "slide:1",
      "supports": [
        "/title",
        "/schedule",
        "/location",
        "/status"
      ]
    },
    {
      "source_id": "instagram:3988052068128727481",
      "locator": "slide:7",
      "supports": [
        "/schedule",
        "/people"
      ]
    }
  ],
  "review": {
    "state": "candidate",
    "uncertainties": [
      "No calendar dates or end date are provided."
    ]
  },
  "notes": null,
  "extra_data": {
    "recitation": "Surah Al-Kahf Recitation"
  },
  "id": "3ffc7881-d2af-4919-9dae-12c13336e624",
  "schema_version": "1.0",
  "sources": [
    {
      "id": "instagram:3988052068128727481",
      "platform": "instagram",
      "url": "https://www.instagram.com/p/DdYaDnykyG5",
      "post_id": "3988052068128727481",
      "author_handle": "masjidsultan",
      "author_profile_id": "1593948450",
      "discovered_via": [],
      "published_at": "2026-09-17T08:14:35.000Z",
      "retrieved_at": "2026-09-21T09:26:39.697Z"
    }
  ]
}
