{
  "schema_version": "1.0",
  "id": "69329659-b0f0-4302-b193-3efac421dcc8",
  "title": "Kuliah Asr",
  "description": null,
  "mosque_ids": [
    "sultan"
  ],
  "categories": [
    "class"
  ],
  "status": "scheduled",
  "schedule": {
    "kind": "recurring",
    "timezone": "Asia/Singapore",
    "text": "Wednesday, only on the 2nd & 4th Week of the Month; After Solat Asr",
    "occurrences": [],
    "recurrence": {
      "frequency": "monthly",
      "weekdays": [
        "WE"
      ],
      "rule_text": "Only on the 2nd & 4th Week of the Month",
      "starts_on": null,
      "ends_on": null,
      "start_time": {
        "kind": "prayer_relative",
        "prayer": "asr",
        "relation": "after",
        "offset_minutes": null,
        "literal": "After Solat Asr"
      },
      "end_time": null,
      "excluded_dates": []
    }
  },
  "location": {
    "mode": "physical",
    "name": "Masjid Sultan Main Prayer Hall",
    "address": null,
    "online_url": null
  },
  "people": [
    {
      "name": "Ustaz Dr. Mohamed Qusairy Thaha",
      "role": "teacher"
    }
  ],
  "languages": [
    "ms"
  ],
  "audience": [],
  "registration": {
    "requirement": "unknown",
    "url": null,
    "deadline_date": null,
    "instructions": null
  },
  "pricing": {
    "kind": "unknown",
    "prices": [],
    "notes": null
  },
  "sources": [
    {
      "id": "instagram:3988052068128727481",
      "platform": "instagram",
      "url": "https://www.instagram.com/p/DdYaDnykyG5/",
      "post_id": "3988052068128727481",
      "author_handle": "masjidsultan",
      "author_profile_id": "1593948450",
      "discovered_via": [
        "https://www.instagram.com/masjidsultan/"
      ],
      "published_at": "2026-09-17T08:14:35.000Z",
      "retrieved_at": "2026-09-21T07:07:01.507Z"
    }
  ],
  "evidence": [
    {
      "source_id": "instagram:3988052068128727481",
      "locator": "slide:3",
      "supports": [
        "/title",
        "/schedule",
        "/location",
        "/people",
        "/languages",
        "/extra_data"
      ]
    },
    {
      "source_id": "instagram:3988052068128727481",
      "locator": "caption and slide:1",
      "supports": [
        "/extra_data/schedule_year_label"
      ]
    }
  ],
  "review": {
    "state": "candidate",
    "uncertainties": [
      "Week-of-month convention not defined; do not assume second/fourth Wednesday.",
      "No explicit start or end date."
    ]
  },
  "notes": null,
  "extra_data": {
    "book": "Tafsir Al-Mishbah",
    "theme": "Tadabbur (Ibrah Al-Quran)",
    "schedule_year_label": 2026
  }
}
