{
  "title": "Majlis Selawat Mingguan",
  "description": "Weekly Friday selawat gathering.",
  "mosque_ids": [
    "sultan"
  ],
  "categories": [
    "selawat",
    "religious remembrance"
  ],
  "status": "scheduled",
  "schedule": {
    "kind": "recurring",
    "timezone": "Asia/Singapore",
    "text": "Every Friday after Solat Isha’",
    "occurrences": [],
    "recurrence": {
      "frequency": "weekly",
      "weekdays": [
        "FR"
      ],
      "rule_text": "Every Friday after Solat Isha’",
      "starts_on": null,
      "ends_on": null,
      "start_time": {
        "kind": "prayer_relative",
        "prayer": "isha",
        "relation": "after",
        "offset_minutes": null,
        "literal": "After Solat Isha’"
      },
      "end_time": null,
      "excluded_dates": []
    }
  },
  "location": {
    "mode": "physical",
    "name": "Masjid Sultan Main Prayer Hall",
    "address": null,
    "online_url": null
  },
  "people": [
    {
      "name": "Ustaz Sofyan Mohd Yadi",
      "role": "leader"
    }
  ],
  "languages": [
    "ms"
  ],
  "audience": [],
  "registration": {
    "requirement": "unknown",
    "url": null,
    "deadline_date": null,
    "instructions": null
  },
  "pricing": {
    "kind": "unknown",
    "prices": [],
    "notes": null
  },
  "evidence": [
    {
      "source_id": "instagram:3988052068128727481",
      "locator": "slide:1",
      "supports": [
        "/title",
        "/schedule",
        "/location",
        "/status"
      ]
    },
    {
      "source_id": "instagram:3988052068128727481",
      "locator": "slide:5",
      "supports": [
        "/schedule",
        "/people",
        "/languages"
      ]
    }
  ],
  "review": {
    "state": "candidate",
    "uncertainties": [
      "No calendar dates or end date are provided."
    ]
  },
  "notes": null,
  "extra_data": {
    "theme": "Kupasan Selawat-Selawat Pilihan & Peribadi Mulia Junjungan (Hadith & Dhikr)",
    "books": "As-Syamail Al-Muhammadiyyah & Keajiban 40 Selawat Pilihan"
  },
  "id": "934a3f66-1435-4c69-b009-1c848a2aa0bb",
  "schema_version": "1.0",
  "sources": [
    {
      "id": "instagram:3988052068128727481",
      "platform": "instagram",
      "url": "https://www.instagram.com/p/DdYaDnykyG5",
      "post_id": "3988052068128727481",
      "author_handle": "masjidsultan",
      "author_profile_id": "1593948450",
      "discovered_via": [],
      "published_at": "2026-09-17T08:14:35.000Z",
      "retrieved_at": "2026-09-21T09:26:39.697Z"
    }
  ]
}
