{
  "title": "Menangani Bisikan Hati Dengan Keimanan",
  "description": "Jumuah khutbah in Malay on overcoming whispers of the heart with faith.",
  "mosque_ids": [
    "al-firdaus"
  ],
  "categories": [
    "sermon",
    "jumuah"
  ],
  "status": "scheduled",
  "schedule": {
    "kind": "one_off",
    "timezone": "Asia/Singapore",
    "text": "18 September 2026; Zuhur 01:00",
    "occurrences": [
      {
        "date": "2026-09-18",
        "end_date": null,
        "start_time": {
          "kind": "clock",
          "local_time": "01:00",
          "literal": "Zuhur 01:00"
        },
        "end_time": null
      }
    ],
    "recurrence": null
  },
  "location": {
    "mode": "physical",
    "name": "Masjid Al-Firdaus",
    "address": "11 Jalan Ibrahim, Singapore 698955",
    "online_url": null
  },
  "people": [
    {
      "name": "Ustaz Muhd Amirul Mukminin Bin Mohd Abdul Wahab",
      "role": "speaker"
    },
    {
      "name": "Hj Sapari Bin Edros",
      "role": "other"
    }
  ],
  "languages": [
    "ms"
  ],
  "audience": [],
  "registration": {
    "requirement": "unknown",
    "url": null,
    "deadline_date": null,
    "instructions": null
  },
  "pricing": {
    "kind": "unknown",
    "prices": [],
    "notes": null
  },
  "sources": [
    {
      "id": "instagram:3988082044257330527",
      "platform": "instagram",
      "url": "https://www.instagram.com/p/DdYg31PEmVf",
      "post_id": "3988082044257330527",
      "author_handle": "alfirdausmosquesg",
      "author_profile_id": "21287478549",
      "discovered_via": [],
      "published_at": "2026-09-17T09:14:08.000Z",
      "retrieved_at": "2026-09-21T08:50:38.044Z"
    }
  ],
  "evidence": [
    {
      "source_id": "instagram:3988082044257330527",
      "locator": "slide:1",
      "supports": [
        "/title",
        "/description",
        "/mosque_ids",
        "/schedule",
        "/location",
        "/people",
        "/languages"
      ]
    }
  ],
  "review": {
    "state": "candidate",
    "uncertainties": [
      "The poster displays Zuhur 01:00 without specifying AM or PM; the time is preserved literally.",
      "The bilal role is represented as other because the contract has no bilal role."
    ]
  },
  "notes": null,
  "extra_data": {
    "hijri_date": "6 Rabiulakhir 1448H",
    "bilal": "Hj Sapari Bin Edros",
    "live_label": "Masjid Al-Firdaus SG"
  },
  "id": "9539fefb-7b71-42d0-b74d-30de2706096f",
  "schema_version": "1.0"
}
